nome,quantidade,preco,data,estado,id
"Aquisição de ventilador mecânico  ... ",1,70000,2020-05-20,PI,CW-005826/20
"ventiladores mecânicos, para equipar o Hospital Nossa Senhora de Fátima",10,121500,2020-05-19,PI,CW-004687/20
"EQUIPAMENTOS HOSPITALARES (VENTILADOR PULMONAR)",12,79000,2020-04-15,PI,CW-003618/20
"VENTILADORES PULMONARES PRESSOMÉTRICO E VOLUMÉTRICO, PARA SEREM USADOS EM CRIANÇAS PORTADORAS DE CORONA VIRUS",10,111090,2020-04-07,PI,CW-003111/20
"VENTILADORES PULMONAR MECÂNICO PNEUMÁTICO PARA SEREM USADOS EM CRIANÇAS PORTADORA DE CORONAVÍRUS",2,26400,2020-04-02,PI,CW-002980/20
"VENTILADOR PULMONAR DE TRANSPORTE MICROPROCESSADOR",1,34000,2020-04-03,PI,CW-003400/19
